{
  "compId": "KHL",
  "season": "2026/27",
  "updatedAt": "2026-10-03T20:15:00Z",
  "groups": [
    {
      "name": "Конференция Запад",
      "type": "conference",
      "rows": [
        {
          "pos": 1,
          "teamId": "khl:lokomotiv",
          "gp": 13,
          "w": 8,
          "wOT": 1,
          "wSO": 1,
          "lOT": 1,
          "lSO": 0,
          "l": 2,
          "gf": 36,
          "ga": 18,
          "gd": 18,
          "pts": 21,
          "form": "WWWLW",
          "zone": "PO"
        },
        {
          "pos": 3,
          "teamId": "khl:ska",
          "gp": 13,
          "w": 7,
          "wOT": 2,
          "wSO": 0,
          "lOT": 1,
          "lSO": 0,
          "l": 3,
          "gf": 45,
          "ga": 28,
          "gd": 17,
          "pts": 19,
          "form": "WWWWL",
          "zone": "PO"
        },
        {
          "pos": 6,
          "teamId": "khl:spartak",
          "gp": 13,
          "w": 7,
          "wOT": 1,
          "wSO": 0,
          "lOT": 2,
          "lSO": 0,
          "l": 3,
          "gf": 39,
          "ga": 29,
          "gd": 10,
          "pts": 18,
          "form": "WLWWW",
          "zone": "PO"
        },
        {
          "pos": 7,
          "teamId": "khl:cska",
          "gp": 13,
          "w": 6,
          "wOT": 2,
          "wSO": 0,
          "lOT": 1,
          "lSO": 1,
          "l": 3,
          "gf": 38,
          "ga": 27,
          "gd": 11,
          "pts": 18,
          "form": "WWOLW",
          "zone": "PO"
        },
        {
          "pos": 9,
          "teamId": "khl:dynamo-msk",
          "gp": 13,
          "w": 6,
          "wOT": 1,
          "wSO": 1,
          "lOT": 0,
          "lSO": 0,
          "l": 5,
          "gf": 33,
          "ga": 29,
          "gd": 4,
          "pts": 16,
          "form": "LWWWL",
          "zone": "OUT"
        },
        {
          "pos": 11,
          "teamId": "khl:severstal",
          "gp": 13,
          "w": 6,
          "wOT": 0,
          "wSO": 1,
          "lOT": 1,
          "lSO": 0,
          "l": 5,
          "gf": 35,
          "ga": 34,
          "gd": 1,
          "pts": 15,
          "form": "WWLLW",
          "zone": "OUT"
        },
        {
          "pos": 12,
          "teamId": "khl:torpedo",
          "gp": 13,
          "w": 5,
          "wOT": 1,
          "wSO": 1,
          "lOT": 1,
          "lSO": 0,
          "l": 5,
          "gf": 37,
          "ga": 36,
          "gd": 1,
          "pts": 15,
          "form": "LWWLW",
          "zone": "OUT"
        },
        {
          "pos": 16,
          "teamId": "khl:dynamo-mns",
          "gp": 12,
          "w": 5,
          "wOT": 0,
          "wSO": 0,
          "lOT": 1,
          "lSO": 1,
          "l": 5,
          "gf": 31,
          "ga": 30,
          "gd": 1,
          "pts": 12,
          "form": "WLLWW",
          "zone": "OUT"
        },
        {
          "pos": 19,
          "teamId": "khl:vityaz",
          "gp": 13,
          "w": 4,
          "wOT": 0,
          "wSO": 0,
          "lOT": 1,
          "lSO": 0,
          "l": 8,
          "gf": 24,
          "ga": 38,
          "gd": -14,
          "pts": 9,
          "form": "LLWLL",
          "zone": "OUT"
        },
        {
          "pos": 21,
          "teamId": "khl:sochi",
          "gp": 13,
          "w": 3,
          "wOT": 1,
          "wSO": 0,
          "lOT": 1,
          "lSO": 0,
          "l": 8,
          "gf": 25,
          "ga": 42,
          "gd": -17,
          "pts": 9,
          "form": "WLLLL",
          "zone": "OUT"
        },
        {
          "pos": 22,
          "teamId": "khl:kunlun",
          "gp": 13,
          "w": 3,
          "wOT": 0,
          "wSO": 1,
          "lOT": 0,
          "lSO": 1,
          "l": 8,
          "gf": 26,
          "ga": 45,
          "gd": -19,
          "pts": 9,
          "form": "LLLWL",
          "zone": "OUT"
        }
      ]
    },
    {
      "name": "Конференция Восток",
      "type": "conference",
      "rows": [
        {
          "pos": 2,
          "teamId": "khl:traktor",
          "gp": 13,
          "w": 8,
          "wOT": 1,
          "wSO": 0,
          "lOT": 1,
          "lSO": 0,
          "l": 3,
          "gf": 40,
          "ga": 24,
          "gd": 16,
          "pts": 19,
          "form": "WWWLW",
          "zone": "PO"
        },
        {
          "pos": 4,
          "teamId": "khl:avtomobilist",
          "gp": 13,
          "w": 7,
          "wOT": 1,
          "wSO": 1,
          "lOT": 1,
          "lSO": 0,
          "l": 3,
          "gf": 38,
          "ga": 26,
          "gd": 12,
          "pts": 19,
          "form": "LWWWW",
          "zone": "PO"
        },
        {
          "pos": 5,
          "teamId": "khl:metallurg-mg",
          "gp": 13,
          "w": 7,
          "wOT": 1,
          "wSO": 0,
          "lOT": 1,
          "lSO": 1,
          "l": 3,
          "gf": 41,
          "ga": 30,
          "gd": 11,
          "pts": 18,
          "form": "WWLWW",
          "zone": "PO"
        },
        {
          "pos": 8,
          "teamId": "khl:ak-bars",
          "gp": 13,
          "w": 7,
          "wOT": 0,
          "wSO": 1,
          "lOT": 0,
          "lSO": 1,
          "l": 4,
          "gf": 38,
          "ga": 27,
          "gd": 11,
          "pts": 17,
          "form": "WWLWW",
          "zone": "PO"
        },
        {
          "pos": 10,
          "teamId": "khl:salavat-yulaev",
          "gp": 12,
          "w": 6,
          "wOT": 1,
          "wSO": 0,
          "lOT": 1,
          "lSO": 0,
          "l": 4,
          "gf": 34,
          "ga": 29,
          "gd": 5,
          "pts": 15,
          "form": "WLWLW",
          "zone": "OUT"
        },
        {
          "pos": 13,
          "teamId": "khl:avangard",
          "gp": 13,
          "w": 5,
          "wOT": 2,
          "wSO": 0,
          "lOT": 1,
          "lSO": 0,
          "l": 5,
          "gf": 32,
          "ga": 31,
          "gd": 1,
          "pts": 15,
          "form": "LWWLL",
          "zone": "OUT"
        },
        {
          "pos": 14,
          "teamId": "khl:admiral",
          "gp": 13,
          "w": 5,
          "wOT": 1,
          "wSO": 0,
          "lOT": 2,
          "lSO": 0,
          "l": 5,
          "gf": 36,
          "ga": 36,
          "gd": 0,
          "pts": 14,
          "form": "WWLLW",
          "zone": "OUT"
        },
        {
          "pos": 15,
          "teamId": "khl:neftekhimik",
          "gp": 13,
          "w": 4,
          "wOT": 1,
          "wSO": 1,
          "lOT": 2,
          "lSO": 0,
          "l": 5,
          "gf": 30,
          "ga": 34,
          "gd": -4,
          "pts": 14,
          "form": "LLWWL",
          "zone": "OUT"
        },
        {
          "pos": 17,
          "teamId": "khl:sibir",
          "gp": 13,
          "w": 5,
          "wOT": 0,
          "wSO": 0,
          "lOT": 0,
          "lSO": 1,
          "l": 7,
          "gf": 29,
          "ga": 37,
          "gd": -8,
          "pts": 11,
          "form": "LLWLL",
          "zone": "OUT"
        },
        {
          "pos": 18,
          "teamId": "khl:lada",
          "gp": 13,
          "w": 4,
          "wOT": 0,
          "wSO": 1,
          "lOT": 1,
          "lSO": 0,
          "l": 7,
          "gf": 26,
          "ga": 35,
          "gd": -9,
          "pts": 11,
          "form": "WLLLL",
          "zone": "OUT"
        },
        {
          "pos": 20,
          "teamId": "khl:amur",
          "gp": 13,
          "w": 3,
          "wOT": 1,
          "wSO": 0,
          "lOT": 1,
          "lSO": 0,
          "l": 8,
          "gf": 23,
          "ga": 39,
          "gd": -16,
          "pts": 9,
          "form": "LLWLL",
          "zone": "OUT"
        },
        {
          "pos": 23,
          "teamId": "khl:barys",
          "gp": 13,
          "w": 2,
          "wOT": 0,
          "wSO": 1,
          "lOT": 1,
          "lSO": 1,
          "l": 8,
          "gf": 17,
          "ga": 41,
          "gd": -24,
          "pts": 8,
          "form": "LLLLL",
          "zone": "OUT"
        }
      ]
    },
    {
      "name": "Дивизион Боброва",
      "type": "division",
      "rows": [
        {
          "pos": 3,
          "teamId": "khl:ska",
          "gp": 13,
          "w": 7,
          "wOT": 2,
          "wSO": 0,
          "lOT": 1,
          "lSO": 0,
          "l": 3,
          "gf": 45,
          "ga": 28,
          "gd": 17,
          "pts": 19,
          "form": "WWWWL",
          "zone": "PO"
        },
        {
          "pos": 6,
          "teamId": "khl:spartak",
          "gp": 13,
          "w": 7,
          "wOT": 1,
          "wSO": 0,
          "lOT": 2,
          "lSO": 0,
          "l": 3,
          "gf": 39,
          "ga": 29,
          "gd": 10,
          "pts": 18,
          "form": "WLWWW",
          "zone": "PO"
        },
        {
          "pos": 12,
          "teamId": "khl:torpedo",
          "gp": 13,
          "w": 5,
          "wOT": 1,
          "wSO": 1,
          "lOT": 1,
          "lSO": 0,
          "l": 5,
          "gf": 37,
          "ga": 36,
          "gd": 1,
          "pts": 15,
          "form": "LWWLW",
          "zone": "OUT"
        },
        {
          "pos": 19,
          "teamId": "khl:vityaz",
          "gp": 13,
          "w": 4,
          "wOT": 0,
          "wSO": 0,
          "lOT": 1,
          "lSO": 0,
          "l": 8,
          "gf": 24,
          "ga": 38,
          "gd": -14,
          "pts": 9,
          "form": "LLWLL",
          "zone": "OUT"
        },
        {
          "pos": 21,
          "teamId": "khl:sochi",
          "gp": 13,
          "w": 3,
          "wOT": 1,
          "wSO": 0,
          "lOT": 1,
          "lSO": 0,
          "l": 8,
          "gf": 25,
          "ga": 42,
          "gd": -17,
          "pts": 9,
          "form": "WLLLL",